MCE/LHJ/LTCF-value,MCE/LHJ/LTCF-alias,Type-value,Type-alias,AGG(Total On Hand Tiberius)-alias
Adventist Health,Adventist Health,MCE,Multi-County Entity,52740
AHMC,AHMC,MCE,Multi-County Entity,1270
Alameda County Public Health Department,Alameda County Public Health Department,LHJ,Local Health Jurisdiction,111554
Albertsons,Albertsons,LTCF,LTCF,297029
Alpine County Health and Human Services,Alpine County Health and Human Services,LHJ,Local Health Jurisdiction,0
"Amador County, Health and Human Services Agency","Amador County, Health and Human Services Agency",LHJ,Local Health Jurisdiction,3822
Berkeley City Public Health Department,Berkeley City Public Health Department,LHJ,Local Health Jurisdiction,1325
Butte County Department of Public Health,Butte County Department of Public Health,LHJ,Local Health Jurisdiction,5875
Calaveras County Public Health Department,Calaveras County Public Health Department,LHJ,Local Health Jurisdiction,0
CDCR,CDCR,MCE,Multi-County Entity,13917
City of Pasadena Public Health Department,City of Pasadena Public Health Department,LHJ,Local Health Jurisdiction,13475
Colusa County Public health,Colusa County Public health,LHJ,Local Health Jurisdiction,5304
Contra Costa County Local Health Department,Contra Costa County Local Health Department,LHJ,Local Health Jurisdiction,61892
Costco,Costco,LTCF,LTCF,13855
CPESN,CPESN,LTCF,LTCF,19428
CVS,CVS,LTCF,LTCF,854476
DaVita,DaVita,LTCF,LTCF,0
Del Norte County Public Health,Del Norte County Public Health,LHJ,Local Health Jurisdiction,1540
Dignity Health,Dignity Health,MCE,Multi-County Entity,42844
DSH,DSH,MCE,Multi-County Entity,1990
El Dorado County Public Health Division,El Dorado County Public Health Division,LHJ,Local Health Jurisdiction,14999
FEMA,FEMA,MCE,Multi-County Entity,44818
Fresno County Department of Public Health,Fresno County Department of Public Health,LHJ,Local Health Jurisdiction,85848
GeriMed,GeriMed,LTCF,LTCF,4374
Glenn County Health Department,Glenn County Health Department,LHJ,Local Health Jurisdiction,1540
Good Neighbor,Good Neighbor,LTCF,LTCF,54311
Health Mart,Health Mart,LTCF,LTCF,3380
HRSA,HRSA,LTCF,LTCF,528635
Humboldt County Department of Health and Human Services,Humboldt County Department of Health and Human Services,LHJ,Local Health Jurisdiction,15005
Imperial County Health Department,Imperial County Health Department,LHJ,Local Health Jurisdiction,29679
Inyo County Health Department,Inyo County Health Department,LHJ,Local Health Jurisdiction,5410
Kaiser,Kaiser *,MCE,Multi-County Entity,935355
Kern County Public Health Services Department,Kern County Public Health Services Department,LHJ,Local Health Jurisdiction,88179
Kern County Public Health Services Department - Provider Account,Kern County Public Health Services Department - Provider Account,LHJ,Local Health Jurisdiction,32114
Kings County Health Department,Kings County Health Department,LHJ,Local Health Jurisdiction,21963
Kroger,Kroger,LTCF,LTCF,23226
Lake County Department of Health Services,Lake County Department of Health Services,LHJ,Local Health Jurisdiction,8040
Lassen County Department of Health and Social Services,Lassen County Department of Health and Social Services,LHJ,Local Health Jurisdiction,709
Long Beach City Department of Health and Human Services,Long Beach City Department of Health and Human Services,LHJ,Local Health Jurisdiction,38482
Los Angeles County Department of Public Health,Los Angeles County Department of Public Health,LHJ,Local Health Jurisdiction,973154
Madera County Public Health,Madera County Public Health,LHJ,Local Health Jurisdiction,27506
Marin County Health and Human Services,Marin County Health and Human Services,LHJ,Local Health Jurisdiction,15269
Mariposa County Health Department,Mariposa County Health Department,LHJ,Local Health Jurisdiction,0
Med Shoppe/LeaderNet,Med Shoppe/LeaderNet,LTCF,LTCF,57503
Mendocino County Dept of Public Health,Mendocino County Dept of Public Health,LHJ,Local Health Jurisdiction,5697
MHA,MHA,LTCF,LTCF,41653
Modoc County Public Health Department,Modoc County Public Health Department,LHJ,Local Health Jurisdiction,630
Mono County Health Department,Mono County Health Department,LHJ,Local Health Jurisdiction,3905
Monterey County Health Department,Monterey County Health Department,LHJ,Local Health Jurisdiction,47884
MULTI,MULTI,LHJ,Local Health Jurisdiction,%null%
Napa County Health and Human Services Agency,Napa County Health and Human Services Agency,LHJ,Local Health Jurisdiction,3986
Nevada County Public Health Department,Nevada County Public Health Department,LHJ,Local Health Jurisdiction,14163
Orange County Health Care Agency,Orange County Health Care Agency,LHJ,Local Health Jurisdiction,199401
Placer County Public Health Division,Placer County Public Health Division,LHJ,Local Health Jurisdiction,28322
Plumas County Public Health Agency,Plumas County Public Health Agency,LHJ,Local Health Jurisdiction,2411
Premier/Innovatix,Premier/Innovatix,LTCF,LTCF,810
Providence,Providence,MCE,Multi-County Entity,94088
Rite Aid,Rite Aid,LTCF,LTCF,356500
Riverside County Department of Health,Riverside County Department of Health,LHJ,Local Health Jurisdiction,165710
Sacramento Department of Health Services,Sacramento Department of Health Services,LHJ,Local Health Jurisdiction,65482
San Benito County Public Health Services,San Benito County Public Health Services,LHJ,Local Health Jurisdiction,4077
San Bernardino County Department of Public Health,San Bernardino County Department of Public Health,LHJ,Local Health Jurisdiction,147945
San Diego Department of Environmental Health,San Diego Department of Environmental Health,LHJ,Local Health Jurisdiction,334311
San Francisco Department of Public Health,San Francisco Department of Public Health,LHJ,Local Health Jurisdiction,77501
San Joaquin County Public Health Services,San Joaquin County Public Health Services,LHJ,Local Health Jurisdiction,52566
San Luis Obispo County Health Department,San Luis Obispo County Health Department,LHJ,Local Health Jurisdiction,23680
San Mateo County Health Service Department,San Mateo County Health Service Department,LHJ,Local Health Jurisdiction,63260
Santa Barbara County Public Health Department,Santa Barbara County Public Health Department,LHJ,Local Health Jurisdiction,49251
Santa Clara County Public Health Department,Santa Clara County Public Health Department,LHJ,Local Health Jurisdiction,200464
Santa Cruz County Local Health Department,Santa Cruz County Local Health Department,LHJ,Local Health Jurisdiction,7819
Shasta County Public Health,Shasta County Public Health,LHJ,Local Health Jurisdiction,12989
Sierra County Health Department,Sierra County Health Department,LHJ,Local Health Jurisdiction,170
Siskiyou County Public Health Department,Siskiyou County Public Health Department,LHJ,Local Health Jurisdiction,6752
Solano County Health and Social Services Dept. - Public Health,Solano County Health and Social Services Dept. - Public Health,LHJ,Local Health Jurisdiction,16026
Sonoma County Department of Health Services,Sonoma County Department of Health Services,LHJ,Local Health Jurisdiction,29421
Stanislaus County Public Health Department,Stanislaus County Public Health Department,LHJ,Local Health Jurisdiction,69979
Sutter County Health Department,Sutter County Health Department,LHJ,Local Health Jurisdiction,3823
Sutter Health,Sutter Health,MCE,Multi-County Entity,122013
Tehama County Health Services Agency,Tehama County Health Services Agency,LHJ,Local Health Jurisdiction,8999
Topco,Topco,LTCF,LTCF,46755
Trinity County Health and Human Services,Trinity County Health and Human Services,LHJ,Local Health Jurisdiction,3050
Tulare County Health and Human Services,Tulare County Health and Human Services,LHJ,Local Health Jurisdiction,81707
Tuolumne County Health Department,Tuolumne County Health Department,LHJ,Local Health Jurisdiction,9917
UC Health,UC Health,MCE,Multi-County Entity,166685
Ventura County Health Department,Ventura County Health Department,LHJ,Local Health Jurisdiction,58765
Walmart,Walmart,LTCF,LTCF,82209
Yolo County Health and Human Services Agency,Yolo County Health and Human Services Agency,LHJ,Local Health Jurisdiction,17125
