MCE/LHJ/LTCF-value,MCE/LHJ/LTCF-alias,Type-value,Type-alias,AGG(Total On Hand Tiberius)-alias
Adventist Health,Adventist Health,MCE,Multi-County Entity,29955
AHMC,AHMC,MCE,Multi-County Entity,5241
Alameda County Public Health Department,Alameda County Public Health Department,LHJ,Local Health Jurisdiction,46014
Albertsons,Albertsons,LTCF,LTCF,367198
Alpine County Health and Human Services,Alpine County Health and Human Services,LHJ,Local Health Jurisdiction,690
"Amador County, Health and Human Services Agency","Amador County, Health and Human Services Agency",LHJ,Local Health Jurisdiction,2153
Berkeley City Public Health Department,Berkeley City Public Health Department,LHJ,Local Health Jurisdiction,4280
Butte County Department of Public Health,Butte County Department of Public Health,LHJ,Local Health Jurisdiction,10157
Calaveras County Public Health Department,Calaveras County Public Health Department,LHJ,Local Health Jurisdiction,7804
CDCR,CDCR,MCE,Multi-County Entity,23556
CDPH,CDPH,MCE,Multi-County Entity,15966
City of Pasadena Public Health Department,City of Pasadena Public Health Department,LHJ,Local Health Jurisdiction,11370
Colusa County Public health,Colusa County Public health,LHJ,Local Health Jurisdiction,2060
Contra Costa County Local Health Department,Contra Costa County Local Health Department,LHJ,Local Health Jurisdiction,50945
Costco,Costco,LTCF,LTCF,61265
County of San Diego Health and Human Services Agency,County of San Diego Health and Human Services Agency,LHJ,Local Health Jurisdiction,136088
CPESN,CPESN,LTCF,LTCF,17315
CVS,CVS,LTCF,LTCF,508944
DaVita,DaVita,LTCF,LTCF,0
Del Norte County Public Health,Del Norte County Public Health,LHJ,Local Health Jurisdiction,1554
Dignity Health,Dignity Health,MCE,Multi-County Entity,25601
DSH,DSH,MCE,Multi-County Entity,2599
El Dorado County Public Health Division,El Dorado County Public Health Division,LHJ,Local Health Jurisdiction,9084
FEMA,FEMA,MCE,Multi-County Entity,830
Fresenius,Fresenius,LTCF,LTCF,1359
Fresno County Department of Public Health,Fresno County Department of Public Health,LHJ,Local Health Jurisdiction,49972
Garfield Health Center - Atlantic,Garfield Health Center - Atlantic,MCE,Multi-County Entity,1169
GeriMed,GeriMed,LTCF,LTCF,4594
Glenn County Health Department,Glenn County Health Department,LHJ,Local Health Jurisdiction,567
Good Neighbor,Good Neighbor,LTCF,LTCF,94567
Health Mart,Health Mart,LTCF,LTCF,41077
HRSA,HRSA,LTCF,LTCF,261254
Humboldt County Department of Health and Human Services,Humboldt County Department of Health and Human Services,LHJ,Local Health Jurisdiction,11050
Imperial County Health Department,Imperial County Health Department,LHJ,Local Health Jurisdiction,14112
Inyo County Health Department,Inyo County Health Department,LHJ,Local Health Jurisdiction,1678
Kaiser,Kaiser *,MCE,Multi-County Entity,436576
Kern County Public Health Services Department,Kern County Public Health Services Department,LHJ,Local Health Jurisdiction,39673
Kings County Health Department,Kings County Health Department,LHJ,Local Health Jurisdiction,4944
Kroger,Kroger,LTCF,LTCF,18488
Lake County Department of Health Services,Lake County Department of Health Services,LHJ,Local Health Jurisdiction,1247
Lassen County Department of Health and Social Services,Lassen County Department of Health and Social Services,LHJ,Local Health Jurisdiction,2200
Long Beach City Department of Health and Human Services,Long Beach City Department of Health and Human Services,LHJ,Local Health Jurisdiction,20885
Los Angeles County Department of Public Health,Los Angeles County Department of Public Health,LHJ,Local Health Jurisdiction,413845
Madera County Public Health,Madera County Public Health,LHJ,Local Health Jurisdiction,15328
Marin County Health and Human Services,Marin County Health and Human Services,LHJ,Local Health Jurisdiction,4183
Mariposa County Health Department,Mariposa County Health Department,LHJ,Local Health Jurisdiction,459
Med Shoppe/LeaderNet,Med Shoppe/LeaderNet,LTCF,LTCF,138132
Mendocino County Dept of Public Health,Mendocino County Dept of Public Health,LHJ,Local Health Jurisdiction,5812
MHA,MHA,LTCF,LTCF,129866
Modoc County Public Health Department,Modoc County Public Health Department,LHJ,Local Health Jurisdiction,614
Mono County Health Department,Mono County Health Department,LHJ,Local Health Jurisdiction,1868
Monterey County Health Department,Monterey County Health Department,LHJ,Local Health Jurisdiction,46905
MULTI,MULTI,LHJ,Local Health Jurisdiction,%null%
Napa County Health and Human Services Agency,Napa County Health and Human Services Agency,LHJ,Local Health Jurisdiction,974
Nevada County Public Health Department,Nevada County Public Health Department,LHJ,Local Health Jurisdiction,5706
Orange County Health Care Agency,Orange County Health Care Agency,LHJ,Local Health Jurisdiction,101228
Placer County Public Health Division,Placer County Public Health Division,LHJ,Local Health Jurisdiction,3735
Plumas County Public Health Agency,Plumas County Public Health Agency,LHJ,Local Health Jurisdiction,1867
Premier/Innovatix,Premier/Innovatix,LTCF,LTCF,5059
Providence,Providence,MCE,Multi-County Entity,45557
Rite Aid,Rite Aid,LTCF,LTCF,256288
Riverside County Department of Health,Riverside County Department of Health,LHJ,Local Health Jurisdiction,61235
Sacramento Department of Health Services,Sacramento Department of Health Services,LHJ,Local Health Jurisdiction,53313
San Benito County Public Health Services,San Benito County Public Health Services,LHJ,Local Health Jurisdiction,3626
San Bernardino County Department of Public Health,San Bernardino County Department of Public Health,LHJ,Local Health Jurisdiction,48019
San Francisco Department of Public Health,San Francisco Department of Public Health,LHJ,Local Health Jurisdiction,28439
San Joaquin County Public Health Services,San Joaquin County Public Health Services,LHJ,Local Health Jurisdiction,35122
San Luis Obispo County Health Department,San Luis Obispo County Health Department,LHJ,Local Health Jurisdiction,12970
San Mateo County Health Service Department,San Mateo County Health Service Department,LHJ,Local Health Jurisdiction,26618
Santa Barbara County Public Health Department,Santa Barbara County Public Health Department,LHJ,Local Health Jurisdiction,18557
Santa Clara County Public Health Department,Santa Clara County Public Health Department,LHJ,Local Health Jurisdiction,106407
Santa Cruz County Local Health Department,Santa Cruz County Local Health Department,LHJ,Local Health Jurisdiction,6261
Shasta County Public Health,Shasta County Public Health,LHJ,Local Health Jurisdiction,7606
Sierra County Health Department,Sierra County Health Department,LHJ,Local Health Jurisdiction,876
Siskiyou County Public Health Department,Siskiyou County Public Health Department,LHJ,Local Health Jurisdiction,3588
Solano County Health and Social Services Dept. - Public Health,Solano County Health and Social Services Dept. - Public Health,LHJ,Local Health Jurisdiction,3657
Sonoma County Department of Health Services,Sonoma County Department of Health Services,LHJ,Local Health Jurisdiction,17172
Stanislaus County Public Health Department,Stanislaus County Public Health Department,LHJ,Local Health Jurisdiction,18776
Sutter County Health Department,Sutter County Health Department,LHJ,Local Health Jurisdiction,4210
Sutter Health,Sutter Health,MCE,Multi-County Entity,29968
Tehama County Health Services Agency,Tehama County Health Services Agency,LHJ,Local Health Jurisdiction,2165
Topco,Topco,LTCF,LTCF,58736
Trinity County Health and Human Services,Trinity County Health and Human Services,LHJ,Local Health Jurisdiction,1030
Tulare County Health and Human Services,Tulare County Health and Human Services,LHJ,Local Health Jurisdiction,29118
Tuolumne County Health Department,Tuolumne County Health Department,LHJ,Local Health Jurisdiction,7335
UC Health,UC Health,MCE,Multi-County Entity,79337
Ventura County Health Department,Ventura County Health Department,LHJ,Local Health Jurisdiction,32053
Walgreens,Walgreens,LTCF,LTCF,191471
Walmart,Walmart,LTCF,LTCF,125282
Yolo County Health and Human Services Agency,Yolo County Health and Human Services Agency,LHJ,Local Health Jurisdiction,7103
