MCE/LHJ/LTCF-value,MCE/LHJ/LTCF-alias,Type-value,Type-alias,AGG(Total On Hand Tiberius)-alias
Adventist Health,Adventist Health,MCE,Multi-County Entity,43515
AHMC,AHMC,MCE,Multi-County Entity,1932
Alameda County Public Health Department,Alameda County Public Health Department,LHJ,Local Health Jurisdiction,73938
Albertsons,Albertsons,LTCF,LTCF,198965
Alpine County Health and Human Services,Alpine County Health and Human Services,LHJ,Local Health Jurisdiction,0
"Amador County, Health and Human Services Agency","Amador County, Health and Human Services Agency",LHJ,Local Health Jurisdiction,2679
Berkeley City Public Health Department,Berkeley City Public Health Department,LHJ,Local Health Jurisdiction,4738
Butte County Department of Public Health,Butte County Department of Public Health,LHJ,Local Health Jurisdiction,23402
Calaveras County Public Health Department,Calaveras County Public Health Department,LHJ,Local Health Jurisdiction,0
CDCR,CDCR,MCE,Multi-County Entity,8927
City of Pasadena Public Health Department,City of Pasadena Public Health Department,LHJ,Local Health Jurisdiction,16872
Colusa County Public health,Colusa County Public health,LHJ,Local Health Jurisdiction,3070
Contra Costa County Local Health Department,Contra Costa County Local Health Department,LHJ,Local Health Jurisdiction,89512
Costco,Costco,LTCF,LTCF,43959
County of San Diego Health and Human Services Agency,County of San Diego Health and Human Services Agency,LHJ,Local Health Jurisdiction,164747
CPESN,CPESN,LTCF,LTCF,8839
CVS,CVS,LTCF,LTCF,846743
DaVita,DaVita,LTCF,LTCF,0
Del Norte County Public Health,Del Norte County Public Health,LHJ,Local Health Jurisdiction,1514
Dignity Health,Dignity Health,MCE,Multi-County Entity,22386
DSH,DSH,MCE,Multi-County Entity,1155
El Dorado County Public Health Division,El Dorado County Public Health Division,LHJ,Local Health Jurisdiction,8338
FEMA,FEMA,MCE,Multi-County Entity,0
Fresenius,Fresenius,LTCF,LTCF,1121
Fresno County Department of Public Health,Fresno County Department of Public Health,LHJ,Local Health Jurisdiction,29676
GeriMed,GeriMed,LTCF,LTCF,1531
Glenn County Health Department,Glenn County Health Department,LHJ,Local Health Jurisdiction,975
Good Neighbor,Good Neighbor,LTCF,LTCF,72375
Health Mart,Health Mart,LTCF,LTCF,48613
HRSA,HRSA,LTCF,LTCF,320801
Humboldt County Department of Health and Human Services,Humboldt County Department of Health and Human Services,LHJ,Local Health Jurisdiction,12228
Imperial County Health Department,Imperial County Health Department,LHJ,Local Health Jurisdiction,7326
Inyo County Health Department,Inyo County Health Department,LHJ,Local Health Jurisdiction,1434
Kaiser,Kaiser *,MCE,Multi-County Entity,795061
Kern County Public Health Services Department,Kern County Public Health Services Department,LHJ,Local Health Jurisdiction,41024
Kings County Health Department,Kings County Health Department,LHJ,Local Health Jurisdiction,15702
Kroger,Kroger,LTCF,LTCF,17298
Lake County Department of Health Services,Lake County Department of Health Services,LHJ,Local Health Jurisdiction,9457
Lassen County Department of Health and Social Services,Lassen County Department of Health and Social Services,LHJ,Local Health Jurisdiction,1700
Long Beach City Department of Health and Human Services,Long Beach City Department of Health and Human Services,LHJ,Local Health Jurisdiction,12954
Los Angeles County Department of Public Health,Los Angeles County Department of Public Health,LHJ,Local Health Jurisdiction,352137
Madera County Public Health,Madera County Public Health,LHJ,Local Health Jurisdiction,16972
Marin County Health and Human Services,Marin County Health and Human Services,LHJ,Local Health Jurisdiction,13285
Mariposa County Health Department,Mariposa County Health Department,LHJ,Local Health Jurisdiction,0
Med Shoppe/LeaderNet,Med Shoppe/LeaderNet,LTCF,LTCF,79578
Mendocino County Dept of Public Health,Mendocino County Dept of Public Health,LHJ,Local Health Jurisdiction,4095
MHA,MHA,LTCF,LTCF,133926
Modoc County Public Health Department,Modoc County Public Health Department,LHJ,Local Health Jurisdiction,1061
Mono County Health Department,Mono County Health Department,LHJ,Local Health Jurisdiction,2628
Monterey County Health Department,Monterey County Health Department,LHJ,Local Health Jurisdiction,60594
MULTI,MULTI,LHJ,Local Health Jurisdiction,%null%
Napa County Health and Human Services Agency,Napa County Health and Human Services Agency,LHJ,Local Health Jurisdiction,1393
Nevada County Public Health Department,Nevada County Public Health Department,LHJ,Local Health Jurisdiction,6145
Orange County Health Care Agency,Orange County Health Care Agency,LHJ,Local Health Jurisdiction,78948
Placer County Public Health Division,Placer County Public Health Division,LHJ,Local Health Jurisdiction,2381
Plumas County Public Health Agency,Plumas County Public Health Agency,LHJ,Local Health Jurisdiction,1725
Premier/Innovatix,Premier/Innovatix,LTCF,LTCF,1840
Providence,Providence,MCE,Multi-County Entity,53673
Rite Aid,Rite Aid,LTCF,LTCF,291100
Riverside County Department of Health,Riverside County Department of Health,LHJ,Local Health Jurisdiction,63289
Sacramento Department of Health Services,Sacramento Department of Health Services,LHJ,Local Health Jurisdiction,24618
San Benito County Public Health Services,San Benito County Public Health Services,LHJ,Local Health Jurisdiction,1861
San Bernardino County Department of Public Health,San Bernardino County Department of Public Health,LHJ,Local Health Jurisdiction,80096
San Francisco Department of Public Health,San Francisco Department of Public Health,LHJ,Local Health Jurisdiction,29101
San Joaquin County Public Health Services,San Joaquin County Public Health Services,LHJ,Local Health Jurisdiction,31459
San Luis Obispo County Health Department,San Luis Obispo County Health Department,LHJ,Local Health Jurisdiction,12345
San Mateo County Health Service Department,San Mateo County Health Service Department,LHJ,Local Health Jurisdiction,23743
Santa Barbara County Public Health Department,Santa Barbara County Public Health Department,LHJ,Local Health Jurisdiction,22738
Santa Clara County Public Health Department,Santa Clara County Public Health Department,LHJ,Local Health Jurisdiction,186595
Santa Cruz County Local Health Department,Santa Cruz County Local Health Department,LHJ,Local Health Jurisdiction,4962
Shasta County Public Health,Shasta County Public Health,LHJ,Local Health Jurisdiction,6825
Sierra County Health Department,Sierra County Health Department,LHJ,Local Health Jurisdiction,1055
Siskiyou County Public Health Department,Siskiyou County Public Health Department,LHJ,Local Health Jurisdiction,8088
Solano County Health and Social Services Dept. - Public Health,Solano County Health and Social Services Dept. - Public Health,LHJ,Local Health Jurisdiction,5286
Sonoma County Department of Health Services,Sonoma County Department of Health Services,LHJ,Local Health Jurisdiction,9881
Stanislaus County Public Health Department,Stanislaus County Public Health Department,LHJ,Local Health Jurisdiction,30728
Sutter County Health Department,Sutter County Health Department,LHJ,Local Health Jurisdiction,2862
Sutter Health,Sutter Health,MCE,Multi-County Entity,76188
Tehama County Health Services Agency,Tehama County Health Services Agency,LHJ,Local Health Jurisdiction,5998
Topco,Topco,LTCF,LTCF,45445
Trinity County Health and Human Services,Trinity County Health and Human Services,LHJ,Local Health Jurisdiction,2295
Tulare County Health and Human Services,Tulare County Health and Human Services,LHJ,Local Health Jurisdiction,57604
Tuolumne County Health Department,Tuolumne County Health Department,LHJ,Local Health Jurisdiction,9002
UC Health,UC Health,MCE,Multi-County Entity,112477
Ventura County Health Department,Ventura County Health Department,LHJ,Local Health Jurisdiction,28172
Walgreens,Walgreens,LTCF,LTCF,150001
Walmart,Walmart,LTCF,LTCF,103000
Yolo County Health and Human Services Agency,Yolo County Health and Human Services Agency,LHJ,Local Health Jurisdiction,7670
