MCE/LHJ/LTCF-value,MCE/LHJ/LTCF-alias,Type-value,Type-alias,AGG(Total On Hand Tiberius)-alias
Adventist Health,Adventist Health,MCE,Multi-County Entity,21649
AHMC,AHMC,MCE,Multi-County Entity,5738
Alameda County Public Health Department,Alameda County Public Health Department,LHJ,Local Health Jurisdiction,86191
Albertsons,Albertsons,LTCF,LTCF,167703
Alpine County Health and Human Services,Alpine County Health and Human Services,LHJ,Local Health Jurisdiction,690
"Amador County, Health and Human Services Agency","Amador County, Health and Human Services Agency",LHJ,Local Health Jurisdiction,2020
Berkeley City Public Health Department,Berkeley City Public Health Department,LHJ,Local Health Jurisdiction,4075
Butte County Department of Public Health,Butte County Department of Public Health,LHJ,Local Health Jurisdiction,32648
Calaveras County Public Health Department,Calaveras County Public Health Department,LHJ,Local Health Jurisdiction,7722
CDCR,CDCR,MCE,Multi-County Entity,20470
City of Pasadena Public Health Department,City of Pasadena Public Health Department,LHJ,Local Health Jurisdiction,10408
Colusa County Public health,Colusa County Public health,LHJ,Local Health Jurisdiction,3290
Contra Costa County Local Health Department,Contra Costa County Local Health Department,LHJ,Local Health Jurisdiction,40228
Costco,Costco,LTCF,LTCF,2617
CPESN,CPESN,LTCF,LTCF,3805
CVS,CVS,LTCF,LTCF,686964
DaVita,DaVita,LTCF,LTCF,%null%
Del Norte County Public Health,Del Norte County Public Health,LHJ,Local Health Jurisdiction,1875
Dignity Health,Dignity Health,MCE,Multi-County Entity,62581
DSH,DSH,MCE,Multi-County Entity,3620
El Dorado County Public Health Division,El Dorado County Public Health Division,LHJ,Local Health Jurisdiction,15808
FEMA,FEMA,MCE,Multi-County Entity,37609
Fresno County Department of Public Health,Fresno County Department of Public Health,LHJ,Local Health Jurisdiction,79224
GeriMed,GeriMed,LTCF,LTCF,2760
Glenn County Health Department,Glenn County Health Department,LHJ,Local Health Jurisdiction,2370
Good Neighbor,Good Neighbor,LTCF,LTCF,20698
Health Mart,Health Mart,LTCF,LTCF,0
HRSA,HRSA,LTCF,LTCF,195792
Humboldt County Department of Health and Human Services,Humboldt County Department of Health and Human Services,LHJ,Local Health Jurisdiction,8214
Imperial County Health Department,Imperial County Health Department,LHJ,Local Health Jurisdiction,17904
Inyo County Health Department,Inyo County Health Department,LHJ,Local Health Jurisdiction,1350
Kaiser,Kaiser *,MCE,Multi-County Entity,488669
Kern County Health Department,Kern County Health Department,LHJ,Local Health Jurisdiction,112477
Kern County Public Health Services Department - Provider Account,Kern County Public Health Services Department - Provider Account,LHJ,Local Health Jurisdiction,1850
Kings County Health Department,Kings County Health Department,LHJ,Local Health Jurisdiction,19359
Kroger,Kroger,LTCF,LTCF,31641
Lake County Department of Health Services,Lake County Department of Health Services,LHJ,Local Health Jurisdiction,7348
Lassen County Department of Health and Social Services,Lassen County Department of Health and Social Services,LHJ,Local Health Jurisdiction,5045
Long Beach City Department of Health and Human Services,Long Beach City Department of Health and Human Services,LHJ,Local Health Jurisdiction,19379
Los Angeles County Department of Public Health,Los Angeles County Department of Public Health,LHJ,Local Health Jurisdiction,430886
Madera County Public Health,Madera County Public Health,LHJ,Local Health Jurisdiction,37080
Marin County Health and Human Services,Marin County Health and Human Services,LHJ,Local Health Jurisdiction,13416
Mariposa County Health Department,Mariposa County Health Department,LHJ,Local Health Jurisdiction,1775
Med Shoppe/LeaderNet,Med Shoppe/LeaderNet,LTCF,LTCF,16049
Mendocino County Dept of Public Health,Mendocino County Dept of Public Health,LHJ,Local Health Jurisdiction,4712
MHA,MHA,LTCF,LTCF,10210
Modoc County Public Health Department,Modoc County Public Health Department,LHJ,Local Health Jurisdiction,760
Mono County Health Department,Mono County Health Department,LHJ,Local Health Jurisdiction,1101
Monterey County Health Department,Monterey County Health Department,LHJ,Local Health Jurisdiction,63227
MULTI,MULTI,LHJ,Local Health Jurisdiction,%null%
Napa County Health and Human Services Agency,Napa County Health and Human Services Agency,LHJ,Local Health Jurisdiction,1228
Nevada County Public Health Department,Nevada County Public Health Department,LHJ,Local Health Jurisdiction,10015
Orange County Health Care Agency,Orange County Health Care Agency,LHJ,Local Health Jurisdiction,157299
Placer County Public Health Division,Placer County Public Health Division,LHJ,Local Health Jurisdiction,9885
Plumas County Public Health Agency,Plumas County Public Health Agency,LHJ,Local Health Jurisdiction,1730
Premier/Innovatix,Premier/Innovatix,LTCF,LTCF,3005
Providence,Providence,MCE,Multi-County Entity,45758
Rite Aid,Rite Aid,LTCF,LTCF,339834
Riverside County Department of Health,Riverside County Department of Health,LHJ,Local Health Jurisdiction,191951
Sacramento Department of Health Services,Sacramento Department of Health Services,LHJ,Local Health Jurisdiction,30651
San Benito County Public Health Services,San Benito County Public Health Services,LHJ,Local Health Jurisdiction,4859
San Bernardino County Department of Public Health,San Bernardino County Department of Public Health,LHJ,Local Health Jurisdiction,97495
San Diego Department of Environmental Health,San Diego Department of Environmental Health,LHJ,Local Health Jurisdiction,115270
San Francisco Department of Public Health,San Francisco Department of Public Health,LHJ,Local Health Jurisdiction,33239
San Joaquin County Public Health Services,San Joaquin County Public Health Services,LHJ,Local Health Jurisdiction,54744
San Luis Obispo County Health Department,San Luis Obispo County Health Department,LHJ,Local Health Jurisdiction,17549
San Mateo County Health Service Department,San Mateo County Health Service Department,LHJ,Local Health Jurisdiction,19962
Santa Barbara County Public Health Department,Santa Barbara County Public Health Department,LHJ,Local Health Jurisdiction,28933
Santa Clara County Public Health Department,Santa Clara County Public Health Department,LHJ,Local Health Jurisdiction,98943
Santa Cruz County Local Health Department,Santa Cruz County Local Health Department,LHJ,Local Health Jurisdiction,15799
Shasta County Public Health,Shasta County Public Health,LHJ,Local Health Jurisdiction,15690
Sierra County Health Department,Sierra County Health Department,LHJ,Local Health Jurisdiction,660
Siskiyou County Public Health Department,Siskiyou County Public Health Department,LHJ,Local Health Jurisdiction,8464
Solano County Health and Social Services Dept. - Public Health,Solano County Health and Social Services Dept. - Public Health,LHJ,Local Health Jurisdiction,11544
Sonoma County Department of Health Services,Sonoma County Department of Health Services,LHJ,Local Health Jurisdiction,16902
Stanislaus County Public Health Department,Stanislaus County Public Health Department,LHJ,Local Health Jurisdiction,42758
Sutter County Health Department,Sutter County Health Department,LHJ,Local Health Jurisdiction,12440
Sutter Health,Sutter Health,MCE,Multi-County Entity,77645
Tehama County Health Services Agency,Tehama County Health Services Agency,LHJ,Local Health Jurisdiction,11009
Topco,Topco,LTCF,LTCF,39023
Trinity County Health and Human Services,Trinity County Health and Human Services,LHJ,Local Health Jurisdiction,3360
Tulare County Health and Human Services,Tulare County Health and Human Services,LHJ,Local Health Jurisdiction,70021
Tuolumne County Health Department,Tuolumne County Health Department,LHJ,Local Health Jurisdiction,6450
UC Health,UC Health,MCE,Multi-County Entity,96357
Ventura County Health Department,Ventura County Health Department,LHJ,Local Health Jurisdiction,17160
Walgreens,Walgreens,LTCF,LTCF,194657
Walmart,Walmart,LTCF,LTCF,33130
Yolo County Health and Human Services Agency,Yolo County Health and Human Services Agency,LHJ,Local Health Jurisdiction,6368
