MCE/LHJ/LTCF-value,MCE/LHJ/LTCF-alias,Type-value,Type-alias,AGG(Total On Hand Tiberius)-alias
Adventist Health,Adventist Health,MCE,Multi-County Entity,42269
AHMC,AHMC,MCE,Multi-County Entity,5649
Alameda County Public Health Department,Alameda County Public Health Department,LHJ,Local Health Jurisdiction,109103
Albertsons,Albertsons,LTCF,LTCF,234271
Alpine County Health and Human Services,Alpine County Health and Human Services,LHJ,Local Health Jurisdiction,690
"Amador County, Health and Human Services Agency","Amador County, Health and Human Services Agency",LHJ,Local Health Jurisdiction,4970
Berkeley City Public Health Department,Berkeley City Public Health Department,LHJ,Local Health Jurisdiction,4015
Butte County Department of Public Health,Butte County Department of Public Health,LHJ,Local Health Jurisdiction,30816
Calaveras County Public Health Department,Calaveras County Public Health Department,LHJ,Local Health Jurisdiction,7722
CDCR,CDCR,MCE,Multi-County Entity,26546
City of Pasadena Public Health Department,City of Pasadena Public Health Department,LHJ,Local Health Jurisdiction,14398
Colusa County Public health,Colusa County Public health,LHJ,Local Health Jurisdiction,3410
Contra Costa County Local Health Department,Contra Costa County Local Health Department,LHJ,Local Health Jurisdiction,52140
Costco,Costco,LTCF,LTCF,2732
CPESN,CPESN,LTCF,LTCF,7090
CVS,CVS,LTCF,LTCF,922049
DaVita,DaVita,LTCF,LTCF,0
Del Norte County Public Health,Del Norte County Public Health,LHJ,Local Health Jurisdiction,2810
Dignity Health,Dignity Health,MCE,Multi-County Entity,42868
DSH,DSH,MCE,Multi-County Entity,3285
El Dorado County Public Health Division,El Dorado County Public Health Division,LHJ,Local Health Jurisdiction,16703
FEMA,FEMA,MCE,Multi-County Entity,59229
Fresno County Department of Public Health,Fresno County Department of Public Health,LHJ,Local Health Jurisdiction,76334
GeriMed,GeriMed,LTCF,LTCF,5004
Glenn County Health Department,Glenn County Health Department,LHJ,Local Health Jurisdiction,1910
Good Neighbor,Good Neighbor,LTCF,LTCF,35246
Health Mart,Health Mart,LTCF,LTCF,23944
HRSA,HRSA,LTCF,LTCF,195542
Humboldt County Department of Health and Human Services,Humboldt County Department of Health and Human Services,LHJ,Local Health Jurisdiction,17591
Imperial County Health Department,Imperial County Health Department,LHJ,Local Health Jurisdiction,21229
Inyo County Health Department,Inyo County Health Department,LHJ,Local Health Jurisdiction,6098
Kaiser,Kaiser *,MCE,Multi-County Entity,599905
Kern County Public Health Services Department,Kern County Public Health Services Department,LHJ,Local Health Jurisdiction,132780
Kern County Public Health Services Department - Provider Account,Kern County Public Health Services Department - Provider Account,LHJ,Local Health Jurisdiction,1250
Kings County Health Department,Kings County Health Department,LHJ,Local Health Jurisdiction,20376
Kroger,Kroger,LTCF,LTCF,30826
Lake County Department of Health Services,Lake County Department of Health Services,LHJ,Local Health Jurisdiction,9126
Lassen County Department of Health and Social Services,Lassen County Department of Health and Social Services,LHJ,Local Health Jurisdiction,3505
Long Beach City Department of Health and Human Services,Long Beach City Department of Health and Human Services,LHJ,Local Health Jurisdiction,28137
Los Angeles County Department of Public Health,Los Angeles County Department of Public Health,LHJ,Local Health Jurisdiction,654744
Madera County Public Health,Madera County Public Health,LHJ,Local Health Jurisdiction,27251
Marin County Health and Human Services,Marin County Health and Human Services,LHJ,Local Health Jurisdiction,30414
Mariposa County Health Department,Mariposa County Health Department,LHJ,Local Health Jurisdiction,1775
Med Shoppe/LeaderNet,Med Shoppe/LeaderNet,LTCF,LTCF,24917
Mendocino County Dept of Public Health,Mendocino County Dept of Public Health,LHJ,Local Health Jurisdiction,6313
MHA,MHA,LTCF,LTCF,20318
Modoc County Public Health Department,Modoc County Public Health Department,LHJ,Local Health Jurisdiction,550
Mono County Health Department,Mono County Health Department,LHJ,Local Health Jurisdiction,2435
Monterey County Health Department,Monterey County Health Department,LHJ,Local Health Jurisdiction,75107
MULTI,MULTI,LHJ,Local Health Jurisdiction,%null%
Napa County Health and Human Services Agency,Napa County Health and Human Services Agency,LHJ,Local Health Jurisdiction,1207
Nevada County Public Health Department,Nevada County Public Health Department,LHJ,Local Health Jurisdiction,13530
Orange County Health Care Agency,Orange County Health Care Agency,LHJ,Local Health Jurisdiction,162172
Placer County Public Health Division,Placer County Public Health Division,LHJ,Local Health Jurisdiction,10940
Plumas County Public Health Agency,Plumas County Public Health Agency,LHJ,Local Health Jurisdiction,3410
Premier/Innovatix,Premier/Innovatix,LTCF,LTCF,2130
Providence,Providence,MCE,Multi-County Entity,52769
Rite Aid,Rite Aid,LTCF,LTCF,322889
Riverside County Department of Health,Riverside County Department of Health,LHJ,Local Health Jurisdiction,165185
Sacramento Department of Health Services,Sacramento Department of Health Services,LHJ,Local Health Jurisdiction,41144
San Benito County Public Health Services,San Benito County Public Health Services,LHJ,Local Health Jurisdiction,2502
San Bernardino County Department of Public Health,San Bernardino County Department of Public Health,LHJ,Local Health Jurisdiction,141957
San Diego Department of Environmental Health,San Diego Department of Environmental Health,LHJ,Local Health Jurisdiction,156362
San Francisco Department of Public Health,San Francisco Department of Public Health,LHJ,Local Health Jurisdiction,40003
San Joaquin County Public Health Services,San Joaquin County Public Health Services,LHJ,Local Health Jurisdiction,52242
San Luis Obispo County Health Department,San Luis Obispo County Health Department,LHJ,Local Health Jurisdiction,17687
San Mateo County Health Service Department,San Mateo County Health Service Department,LHJ,Local Health Jurisdiction,26288
Santa Barbara County Public Health Department,Santa Barbara County Public Health Department,LHJ,Local Health Jurisdiction,50827
Santa Clara County Public Health Department,Santa Clara County Public Health Department,LHJ,Local Health Jurisdiction,112804
Santa Cruz County Local Health Department,Santa Cruz County Local Health Department,LHJ,Local Health Jurisdiction,10599
Shasta County Public Health,Shasta County Public Health,LHJ,Local Health Jurisdiction,17302
Sierra County Health Department,Sierra County Health Department,LHJ,Local Health Jurisdiction,830
Siskiyou County Public Health Department,Siskiyou County Public Health Department,LHJ,Local Health Jurisdiction,7618
Solano County Health and Social Services Dept. - Public Health,Solano County Health and Social Services Dept. - Public Health,LHJ,Local Health Jurisdiction,17484
Sonoma County Department of Health Services,Sonoma County Department of Health Services,LHJ,Local Health Jurisdiction,14831
Stanislaus County Public Health Department,Stanislaus County Public Health Department,LHJ,Local Health Jurisdiction,64214
Sutter County Health Department,Sutter County Health Department,LHJ,Local Health Jurisdiction,14195
Sutter Health,Sutter Health,MCE,Multi-County Entity,83463
Tehama County Health Services Agency,Tehama County Health Services Agency,LHJ,Local Health Jurisdiction,11107
Topco,Topco,LTCF,LTCF,57765
Trinity County Health and Human Services,Trinity County Health and Human Services,LHJ,Local Health Jurisdiction,3390
Tulare County Health and Human Services,Tulare County Health and Human Services,LHJ,Local Health Jurisdiction,78531
Tuolumne County Health Department,Tuolumne County Health Department,LHJ,Local Health Jurisdiction,8440
UC Health,UC Health,MCE,Multi-County Entity,83019
Ventura County Health Department,Ventura County Health Department,LHJ,Local Health Jurisdiction,24340
Walgreens,Walgreens,LTCF,LTCF,203305
Walmart,Walmart,LTCF,LTCF,21267
Yolo County Health and Human Services Agency,Yolo County Health and Human Services Agency,LHJ,Local Health Jurisdiction,12335
