MCE/LHJ/LTCF-value,MCE/LHJ/LTCF-alias,Type-value,Type-alias,AGG(Total On Hand Tiberius)-alias
Adventist Health,Adventist Health,MCE,Multi-County Entity,42490
AHMC,AHMC,MCE,Multi-County Entity,640
Alameda County Public Health Department,Alameda County Public Health Department,LHJ,Local Health Jurisdiction,101820
Albertsons,Albertsons,LTCF,LTCF,253507
Alpine County Health and Human Services,Alpine County Health and Human Services,LHJ,Local Health Jurisdiction,0
"Amador County, Health and Human Services Agency","Amador County, Health and Human Services Agency",LHJ,Local Health Jurisdiction,3531
Berkeley City Public Health Department,Berkeley City Public Health Department,LHJ,Local Health Jurisdiction,200
Butte County Department of Public Health,Butte County Department of Public Health,LHJ,Local Health Jurisdiction,27622
Calaveras County Public Health Department,Calaveras County Public Health Department,LHJ,Local Health Jurisdiction,0
CDCR,CDCR,MCE,Multi-County Entity,11849
City of Pasadena Public Health Department,City of Pasadena Public Health Department,LHJ,Local Health Jurisdiction,12611
Colusa County Public health,Colusa County Public health,LHJ,Local Health Jurisdiction,4418
Contra Costa County Local Health Department,Contra Costa County Local Health Department,LHJ,Local Health Jurisdiction,98131
Costco,Costco,LTCF,LTCF,16659
CPESN,CPESN,LTCF,LTCF,11698
CVS,CVS,LTCF,LTCF,946570
DaVita,DaVita,LTCF,LTCF,0
Del Norte County Public Health,Del Norte County Public Health,LHJ,Local Health Jurisdiction,3082
Dignity Health,Dignity Health,MCE,Multi-County Entity,44554
DSH,DSH,MCE,Multi-County Entity,1155
El Dorado County Public Health Division,El Dorado County Public Health Division,LHJ,Local Health Jurisdiction,11577
FEMA,FEMA,MCE,Multi-County Entity,4020
Fresno County Department of Public Health,Fresno County Department of Public Health,LHJ,Local Health Jurisdiction,46715
GeriMed,GeriMed,LTCF,LTCF,3458
Glenn County Health Department,Glenn County Health Department,LHJ,Local Health Jurisdiction,1306
Good Neighbor,Good Neighbor,LTCF,LTCF,55737
Health Mart,Health Mart,LTCF,LTCF,32518
HRSA,HRSA,LTCF,LTCF,295372
Humboldt County Department of Health and Human Services,Humboldt County Department of Health and Human Services,LHJ,Local Health Jurisdiction,11022
Imperial County Health Department,Imperial County Health Department,LHJ,Local Health Jurisdiction,16519
Inyo County Health Department,Inyo County Health Department,LHJ,Local Health Jurisdiction,4498
Kaiser,Kaiser *,MCE,Multi-County Entity,1067770
Kern County Public Health Services Department,Kern County Public Health Services Department,LHJ,Local Health Jurisdiction,49905
Kern County Public Health Services Department - Provider Account,Kern County Public Health Services Department - Provider Account,LHJ,Local Health Jurisdiction,6558
Kings County Health Department,Kings County Health Department,LHJ,Local Health Jurisdiction,17489
Kroger,Kroger,LTCF,LTCF,29346
Lake County Department of Health Services,Lake County Department of Health Services,LHJ,Local Health Jurisdiction,7180
Lassen County Department of Health and Social Services,Lassen County Department of Health and Social Services,LHJ,Local Health Jurisdiction,887
Long Beach City Department of Health and Human Services,Long Beach City Department of Health and Human Services,LHJ,Local Health Jurisdiction,40987
Los Angeles County Department of Public Health,Los Angeles County Department of Public Health,LHJ,Local Health Jurisdiction,756041
Madera County Public Health,Madera County Public Health,LHJ,Local Health Jurisdiction,23796
Marin County Health and Human Services,Marin County Health and Human Services,LHJ,Local Health Jurisdiction,24921
Mariposa County Health Department,Mariposa County Health Department,LHJ,Local Health Jurisdiction,2006
Med Shoppe/LeaderNet,Med Shoppe/LeaderNet,LTCF,LTCF,69568
Mendocino County Dept of Public Health,Mendocino County Dept of Public Health,LHJ,Local Health Jurisdiction,3972
MHA,MHA,LTCF,LTCF,29227
Modoc County Public Health Department,Modoc County Public Health Department,LHJ,Local Health Jurisdiction,380
Mono County Health Department,Mono County Health Department,LHJ,Local Health Jurisdiction,3283
Monterey County Health Department,Monterey County Health Department,LHJ,Local Health Jurisdiction,75492
MULTI,MULTI,LHJ,Local Health Jurisdiction,%null%
Napa County Health and Human Services Agency,Napa County Health and Human Services Agency,LHJ,Local Health Jurisdiction,3859
Nevada County Public Health Department,Nevada County Public Health Department,LHJ,Local Health Jurisdiction,11104
Orange County Health Care Agency,Orange County Health Care Agency,LHJ,Local Health Jurisdiction,143784
Placer County Public Health Division,Placer County Public Health Division,LHJ,Local Health Jurisdiction,26182
Plumas County Public Health Agency,Plumas County Public Health Agency,LHJ,Local Health Jurisdiction,3089
Premier/Innovatix,Premier/Innovatix,LTCF,LTCF,1685
Providence,Providence,MCE,Multi-County Entity,91544
Rite Aid,Rite Aid,LTCF,LTCF,384968
Riverside County Department of Health,Riverside County Department of Health,LHJ,Local Health Jurisdiction,129377
Sacramento Department of Health Services,Sacramento Department of Health Services,LHJ,Local Health Jurisdiction,68063
San Benito County Public Health Services,San Benito County Public Health Services,LHJ,Local Health Jurisdiction,2335
San Bernardino County Department of Public Health,San Bernardino County Department of Public Health,LHJ,Local Health Jurisdiction,134794
San Diego Department of Environmental Health,San Diego Department of Environmental Health,LHJ,Local Health Jurisdiction,272294
San Francisco Department of Public Health,San Francisco Department of Public Health,LHJ,Local Health Jurisdiction,68344
San Joaquin County Public Health Services,San Joaquin County Public Health Services,LHJ,Local Health Jurisdiction,48938
San Luis Obispo County Health Department,San Luis Obispo County Health Department,LHJ,Local Health Jurisdiction,23060
San Mateo County Health Service Department,San Mateo County Health Service Department,LHJ,Local Health Jurisdiction,57586
Santa Barbara County Public Health Department,Santa Barbara County Public Health Department,LHJ,Local Health Jurisdiction,33102
Santa Clara County Public Health Department,Santa Clara County Public Health Department,LHJ,Local Health Jurisdiction,336010
Santa Cruz County Local Health Department,Santa Cruz County Local Health Department,LHJ,Local Health Jurisdiction,8642
Shasta County Public Health,Shasta County Public Health,LHJ,Local Health Jurisdiction,9332
Sierra County Health Department,Sierra County Health Department,LHJ,Local Health Jurisdiction,0
Siskiyou County Public Health Department,Siskiyou County Public Health Department,LHJ,Local Health Jurisdiction,8474
Solano County Health and Social Services Dept. - Public Health,Solano County Health and Social Services Dept. - Public Health,LHJ,Local Health Jurisdiction,6512
Sonoma County Department of Health Services,Sonoma County Department of Health Services,LHJ,Local Health Jurisdiction,24134
Stanislaus County Public Health Department,Stanislaus County Public Health Department,LHJ,Local Health Jurisdiction,45792
Sutter County Health Department,Sutter County Health Department,LHJ,Local Health Jurisdiction,3482
Sutter Health,Sutter Health,MCE,Multi-County Entity,102353
Tehama County Health Services Agency,Tehama County Health Services Agency,LHJ,Local Health Jurisdiction,6880
Topco,Topco,LTCF,LTCF,45036
Trinity County Health and Human Services,Trinity County Health and Human Services,LHJ,Local Health Jurisdiction,0
Tulare County Health and Human Services,Tulare County Health and Human Services,LHJ,Local Health Jurisdiction,74043
Tuolumne County Health Department,Tuolumne County Health Department,LHJ,Local Health Jurisdiction,10356
UC Health,UC Health,MCE,Multi-County Entity,164415
Ventura County Health Department,Ventura County Health Department,LHJ,Local Health Jurisdiction,46773
Walmart,Walmart,LTCF,LTCF,45383
Yolo County Health and Human Services Agency,Yolo County Health and Human Services Agency,LHJ,Local Health Jurisdiction,11476
