MCE/LHJ/LTCF-value,MCE/LHJ/LTCF-alias,Type-value,Type-alias,AGG(Total On Hand Tiberius)-alias
Adventist Health,Adventist Health,MCE,Multi-County Entity,12685
AHMC,AHMC,MCE,Multi-County Entity,733
Alameda County Public Health Department,Alameda County Public Health Department,LHJ,Local Health Jurisdiction,30425
Albertsons,Albertsons,LTCF,LTCF,321858
Alpine County Health and Human Services,Alpine County Health and Human Services,LHJ,Local Health Jurisdiction,40
"Amador County, Health and Human Services Agency","Amador County, Health and Human Services Agency",LHJ,Local Health Jurisdiction,588
Berkeley City Public Health Department,Berkeley City Public Health Department,LHJ,Local Health Jurisdiction,20926
Butte County Department of Public Health,Butte County Department of Public Health,LHJ,Local Health Jurisdiction,2332
Calaveras County Public Health Department,Calaveras County Public Health Department,LHJ,Local Health Jurisdiction,1115
CDCR,CDCR,MCE,Multi-County Entity,14232
CDPH,CDPH,MCE,Multi-County Entity,20214
City of Pasadena Public Health Department,City of Pasadena Public Health Department,LHJ,Local Health Jurisdiction,5065
Colusa County Public health,Colusa County Public health,LHJ,Local Health Jurisdiction,1050
Contra Costa County Local Health Department,Contra Costa County Local Health Department,LHJ,Local Health Jurisdiction,27883
Costco,Costco,LTCF,LTCF,53692
County of San Diego Health and Human Services Agency,County of San Diego Health and Human Services Agency,LHJ,Local Health Jurisdiction,71278
CPESN,CPESN,LTCF,LTCF,9097
CVS,CVS,LTCF,LTCF,287429
DaVita,DaVita,LTCF,LTCF,119
Del Norte County Public Health,Del Norte County Public Health,LHJ,Local Health Jurisdiction,1024
Dignity Health,Dignity Health,MCE,Multi-County Entity,9889
DSH,DSH,MCE,Multi-County Entity,1425
El Dorado County Public Health Division,El Dorado County Public Health Division,LHJ,Local Health Jurisdiction,2366
FEMA,FEMA,MCE,Multi-County Entity,2242
Fresenius,Fresenius,LTCF,LTCF,278
Fresno County Department of Public Health,Fresno County Department of Public Health,LHJ,Local Health Jurisdiction,28116
GeriMed,GeriMed,LTCF,LTCF,1479
Glenn County Health Department,Glenn County Health Department,LHJ,Local Health Jurisdiction,386
Good Neighbor,Good Neighbor,LTCF,LTCF,66928
Health Mart,Health Mart,LTCF,LTCF,15219
HRSA,HRSA,LTCF,LTCF,185938
Humboldt County Department of Health and Human Services,Humboldt County Department of Health and Human Services,LHJ,Local Health Jurisdiction,5934
Imperial County Health Department,Imperial County Health Department,LHJ,Local Health Jurisdiction,6521
Inyo County Health Department,Inyo County Health Department,LHJ,Local Health Jurisdiction,1054
Kaiser,Kaiser *,MCE,Multi-County Entity,264498
Kern County Public Health Services Department,Kern County Public Health Services Department,LHJ,Local Health Jurisdiction,15338
Kings County Health Department,Kings County Health Department,LHJ,Local Health Jurisdiction,2037
Kroger,Kroger,LTCF,LTCF,27435
Lake County Department of Health Services,Lake County Department of Health Services,LHJ,Local Health Jurisdiction,1204
Lassen County Department of Health and Social Services,Lassen County Department of Health and Social Services,LHJ,Local Health Jurisdiction,1700
Long Beach City Department of Health and Human Services,Long Beach City Department of Health and Human Services,LHJ,Local Health Jurisdiction,4113
Los Angeles County Department of Public Health,Los Angeles County Department of Public Health,LHJ,Local Health Jurisdiction,227299
Madera County Public Health,Madera County Public Health,LHJ,Local Health Jurisdiction,5178
Marin County Health and Human Services,Marin County Health and Human Services,LHJ,Local Health Jurisdiction,12948
Mariposa County Health and Human Services,Mariposa County Health and Human Services,LHJ,Local Health Jurisdiction,413
Med Shoppe/LeaderNet,Med Shoppe/LeaderNet,LTCF,LTCF,100393
Mendocino County Dept of Public Health,Mendocino County Dept of Public Health,LHJ,Local Health Jurisdiction,2578
Merced County Department of Public Health,Merced County Department of Public Health,LHJ,Local Health Jurisdiction,5271
MHA,MHA,LTCF,LTCF,28994
Modoc County Public Health Department,Modoc County Public Health Department,LHJ,Local Health Jurisdiction,546
Mono County Health Department,Mono County Health Department,LHJ,Local Health Jurisdiction,677
Monterey County Health Department,Monterey County Health Department,LHJ,Local Health Jurisdiction,11169
MULTI,MULTI,LHJ,Local Health Jurisdiction,%null%
Napa County Health and Human Services Agency,Napa County Health and Human Services Agency,LHJ,Local Health Jurisdiction,1036
Nevada County Public Health Department,Nevada County Public Health Department,LHJ,Local Health Jurisdiction,1935
Orange County Health Care Agency,Orange County Health Care Agency,LHJ,Local Health Jurisdiction,53847
Out of State Organizations,Out of State Organizations,MCE,Multi-County Entity,1842
Placer County Public Health Division,Placer County Public Health Division,LHJ,Local Health Jurisdiction,2131
Plumas County Public Health Agency,Plumas County Public Health Agency,LHJ,Local Health Jurisdiction,1058
Premier/Innovatix,Premier/Innovatix,LTCF,LTCF,1174
Providence,Providence,MCE,Multi-County Entity,25130
Rite Aid,Rite Aid,LTCF,LTCF,307597
Riverside County Department of Health,Riverside County Department of Health,LHJ,Local Health Jurisdiction,49397
Sacramento Department of Health Services,Sacramento Department of Health Services,LHJ,Local Health Jurisdiction,18187
San Benito County Public Health Services,San Benito County Public Health Services,LHJ,Local Health Jurisdiction,1966
San Bernardino County Department of Public Health,San Bernardino County Department of Public Health,LHJ,Local Health Jurisdiction,30897
San Francisco Department of Public Health,San Francisco Department of Public Health,LHJ,Local Health Jurisdiction,25084
San Joaquin County Public Health Services,San Joaquin County Public Health Services,LHJ,Local Health Jurisdiction,20974
San Luis Obispo County Health Department,San Luis Obispo County Health Department,LHJ,Local Health Jurisdiction,4175
San Mateo County Health Service Department,San Mateo County Health Service Department,LHJ,Local Health Jurisdiction,16693
Santa Barbara County Public Health Department,Santa Barbara County Public Health Department,LHJ,Local Health Jurisdiction,12609
Santa Clara County Public Health Department,Santa Clara County Public Health Department,LHJ,Local Health Jurisdiction,38802
Santa Cruz County Local Health Department,Santa Cruz County Local Health Department,LHJ,Local Health Jurisdiction,2903
Shasta County Public Health,Shasta County Public Health,LHJ,Local Health Jurisdiction,2536
Sierra County Health Department,Sierra County Health Department,LHJ,Local Health Jurisdiction,110
Siskiyou County Public Health Department,Siskiyou County Public Health Department,LHJ,Local Health Jurisdiction,3374
Solano County Health and Social Services Dept. - Public Health,Solano County Health and Social Services Dept. - Public Health,LHJ,Local Health Jurisdiction,3079
Sonoma County Department of Health Services,Sonoma County Department of Health Services,LHJ,Local Health Jurisdiction,8555
Stanislaus County Public Health Department,Stanislaus County Public Health Department,LHJ,Local Health Jurisdiction,7940
Sutter County Health Department,Sutter County Health Department,LHJ,Local Health Jurisdiction,4045
Sutter Health,Sutter Health,MCE,Multi-County Entity,14195
Tehama County Health Services Agency,Tehama County Health Services Agency,LHJ,Local Health Jurisdiction,1131
Topco,Topco,LTCF,LTCF,71814
Trinity County Health and Human Services,Trinity County Health and Human Services,LHJ,Local Health Jurisdiction,655
Tulare County Health and Human Services,Tulare County Health and Human Services,LHJ,Local Health Jurisdiction,13316
Tuolumne County Health Department,Tuolumne County Health Department,LHJ,Local Health Jurisdiction,1221
UC Health,UC Health,MCE,Multi-County Entity,29350
Ventura County Health Department,Ventura County Health Department,LHJ,Local Health Jurisdiction,19623
Walgreens,Walgreens,LTCF,LTCF,133018
Walmart,Walmart,LTCF,LTCF,75853
Yolo County Health and Human Services Agency,Yolo County Health and Human Services Agency,LHJ,Local Health Jurisdiction,3606
