MCE/LHJ/LTCF-value,MCE/LHJ/LTCF-alias,Type-value,Type-alias,AGG(Total On Hand Tiberius)-alias
Adventist Health,Adventist Health,MCE,Multi-County Entity,13032
AHMC,AHMC,MCE,Multi-County Entity,725
Alameda County Public Health Department,Alameda County Public Health Department,LHJ,Local Health Jurisdiction,31624
Albertsons,Albertsons,LTCF,LTCF,314051
Alpine County Health and Human Services,Alpine County Health and Human Services,LHJ,Local Health Jurisdiction,40
"Amador County, Health and Human Services Agency","Amador County, Health and Human Services Agency",LHJ,Local Health Jurisdiction,721
Berkeley City Public Health Department,Berkeley City Public Health Department,LHJ,Local Health Jurisdiction,20109
Butte County Department of Public Health,Butte County Department of Public Health,LHJ,Local Health Jurisdiction,2590
Calaveras County Public Health Department,Calaveras County Public Health Department,LHJ,Local Health Jurisdiction,1205
CDCR,CDCR,MCE,Multi-County Entity,13433
CDPH,CDPH,MCE,Multi-County Entity,20214
City of Pasadena Public Health Department,City of Pasadena Public Health Department,LHJ,Local Health Jurisdiction,4586
Colusa County Public health,Colusa County Public health,LHJ,Local Health Jurisdiction,1144
Contra Costa County Local Health Department,Contra Costa County Local Health Department,LHJ,Local Health Jurisdiction,28496
Costco,Costco,LTCF,LTCF,50314
County of San Diego Health and Human Services Agency,County of San Diego Health and Human Services Agency,LHJ,Local Health Jurisdiction,73102
CPESN,CPESN,LTCF,LTCF,8761
CVS,CVS,LTCF,LTCF,322952
DaVita,DaVita,LTCF,LTCF,119
Del Norte County Public Health,Del Norte County Public Health,LHJ,Local Health Jurisdiction,1234
Dignity Health,Dignity Health,MCE,Multi-County Entity,11863
DSH,DSH,MCE,Multi-County Entity,1523
El Dorado County Public Health Division,El Dorado County Public Health Division,LHJ,Local Health Jurisdiction,6016
FEMA,FEMA,MCE,Multi-County Entity,2440
Fresenius,Fresenius,LTCF,LTCF,457
Fresno County Department of Public Health,Fresno County Department of Public Health,LHJ,Local Health Jurisdiction,29345
GeriMed,GeriMed,LTCF,LTCF,1682
Glenn County Health Department,Glenn County Health Department,LHJ,Local Health Jurisdiction,400
Good Neighbor,Good Neighbor,LTCF,LTCF,71473
Health Mart,Health Mart,LTCF,LTCF,15657
HRSA,HRSA,LTCF,LTCF,174012
Humboldt County Department of Health and Human Services,Humboldt County Department of Health and Human Services,LHJ,Local Health Jurisdiction,6211
Imperial County Health Department,Imperial County Health Department,LHJ,Local Health Jurisdiction,8243
Inyo County Health Department,Inyo County Health Department,LHJ,Local Health Jurisdiction,1421
Kaiser,Kaiser *,MCE,Multi-County Entity,289137
Kern County Public Health Services Department,Kern County Public Health Services Department,LHJ,Local Health Jurisdiction,17908
Kings County Health Department,Kings County Health Department,LHJ,Local Health Jurisdiction,2445
Kroger,Kroger,LTCF,LTCF,27047
Lake County Department of Health Services,Lake County Department of Health Services,LHJ,Local Health Jurisdiction,1276
Lassen County Department of Health and Social Services,Lassen County Department of Health and Social Services,LHJ,Local Health Jurisdiction,1670
Long Beach City Department of Health and Human Services,Long Beach City Department of Health and Human Services,LHJ,Local Health Jurisdiction,4946
Los Angeles County Department of Public Health,Los Angeles County Department of Public Health,LHJ,Local Health Jurisdiction,226685
Madera County Public Health,Madera County Public Health,LHJ,Local Health Jurisdiction,5272
Marin County Health and Human Services,Marin County Health and Human Services,LHJ,Local Health Jurisdiction,13268
Mariposa County Health and Human Services,Mariposa County Health and Human Services,LHJ,Local Health Jurisdiction,287
Med Shoppe/LeaderNet,Med Shoppe/LeaderNet,LTCF,LTCF,104203
Mendocino County Dept of Public Health,Mendocino County Dept of Public Health,LHJ,Local Health Jurisdiction,2657
Merced County Department of Public Health,Merced County Department of Public Health,LHJ,Local Health Jurisdiction,4931
MHA,MHA,LTCF,LTCF,34380
Modoc County Public Health Department,Modoc County Public Health Department,LHJ,Local Health Jurisdiction,467
Mono County Health Department,Mono County Health Department,LHJ,Local Health Jurisdiction,1175
Monterey County Health Department,Monterey County Health Department,LHJ,Local Health Jurisdiction,10555
MULTI,MULTI,LHJ,Local Health Jurisdiction,%null%
Napa County Health and Human Services Agency,Napa County Health and Human Services Agency,LHJ,Local Health Jurisdiction,1232
Nevada County Public Health Department,Nevada County Public Health Department,LHJ,Local Health Jurisdiction,1890
Orange County Health Care Agency,Orange County Health Care Agency,LHJ,Local Health Jurisdiction,56224
Out of State Organizations,Out of State Organizations,MCE,Multi-County Entity,3190
Placer County Public Health Division,Placer County Public Health Division,LHJ,Local Health Jurisdiction,2756
Plumas County Public Health Agency,Plumas County Public Health Agency,LHJ,Local Health Jurisdiction,1193
Premier/Innovatix,Premier/Innovatix,LTCF,LTCF,2619
Providence,Providence,MCE,Multi-County Entity,24267
Rite Aid,Rite Aid,LTCF,LTCF,303517
Riverside County Department of Health,Riverside County Department of Health,LHJ,Local Health Jurisdiction,49920
Sacramento Department of Health Services,Sacramento Department of Health Services,LHJ,Local Health Jurisdiction,18732
San Benito County Public Health Services,San Benito County Public Health Services,LHJ,Local Health Jurisdiction,2249
San Bernardino County Department of Public Health,San Bernardino County Department of Public Health,LHJ,Local Health Jurisdiction,31204
San Francisco Department of Public Health,San Francisco Department of Public Health,LHJ,Local Health Jurisdiction,30864
San Joaquin County Public Health Services,San Joaquin County Public Health Services,LHJ,Local Health Jurisdiction,22394
San Luis Obispo County Health Department,San Luis Obispo County Health Department,LHJ,Local Health Jurisdiction,2969
San Mateo County Health Service Department,San Mateo County Health Service Department,LHJ,Local Health Jurisdiction,17139
Santa Barbara County Public Health Department,Santa Barbara County Public Health Department,LHJ,Local Health Jurisdiction,11292
Santa Clara County Public Health Department,Santa Clara County Public Health Department,LHJ,Local Health Jurisdiction,40780
Santa Cruz County Local Health Department,Santa Cruz County Local Health Department,LHJ,Local Health Jurisdiction,2658
Shasta County Public Health,Shasta County Public Health,LHJ,Local Health Jurisdiction,2686
Sierra County Health Department,Sierra County Health Department,LHJ,Local Health Jurisdiction,126
Siskiyou County Public Health Department,Siskiyou County Public Health Department,LHJ,Local Health Jurisdiction,3362
Solano County Health and Social Services Dept. - Public Health,Solano County Health and Social Services Dept. - Public Health,LHJ,Local Health Jurisdiction,3511
Sonoma County Department of Health Services,Sonoma County Department of Health Services,LHJ,Local Health Jurisdiction,9253
Stanislaus County Public Health Department,Stanislaus County Public Health Department,LHJ,Local Health Jurisdiction,12114
Sutter County Health Department,Sutter County Health Department,LHJ,Local Health Jurisdiction,4174
Sutter Health,Sutter Health,MCE,Multi-County Entity,15175
Tehama County Health Services Agency,Tehama County Health Services Agency,LHJ,Local Health Jurisdiction,1213
Topco,Topco,LTCF,LTCF,73020
Trinity County Health and Human Services,Trinity County Health and Human Services,LHJ,Local Health Jurisdiction,845
Tulare County Health and Human Services,Tulare County Health and Human Services,LHJ,Local Health Jurisdiction,13454
Tuolumne County Health Department,Tuolumne County Health Department,LHJ,Local Health Jurisdiction,1452
UC Health,UC Health,MCE,Multi-County Entity,40449
Ventura County Health Department,Ventura County Health Department,LHJ,Local Health Jurisdiction,19624
Walgreens,Walgreens,LTCF,LTCF,135785
Walmart,Walmart,LTCF,LTCF,77357
Yolo County Health and Human Services Agency,Yolo County Health and Human Services Agency,LHJ,Local Health Jurisdiction,6483
