MCE/LHJ/LTCF-value,MCE/LHJ/LTCF-alias,Type-value,Type-alias,AGG(Total On Hand Tiberius)-alias
Adventist Health,Adventist Health,MCE,Multi-County Entity,20989
AHMC,AHMC,MCE,Multi-County Entity,2557
Alameda County Public Health Department,Alameda County Public Health Department,LHJ,Local Health Jurisdiction,51301
Albertsons,Albertsons,LTCF,LTCF,309301
Alpine County Health and Human Services,Alpine County Health and Human Services,LHJ,Local Health Jurisdiction,50
"Amador County, Health and Human Services Agency","Amador County, Health and Human Services Agency",LHJ,Local Health Jurisdiction,2076
Berkeley City Public Health Department,Berkeley City Public Health Department,LHJ,Local Health Jurisdiction,13000
Butte County Department of Public Health,Butte County Department of Public Health,LHJ,Local Health Jurisdiction,4433
Calaveras County Public Health Department,Calaveras County Public Health Department,LHJ,Local Health Jurisdiction,2487
CDCR,CDCR,MCE,Multi-County Entity,10998
CDPH,CDPH,MCE,Multi-County Entity,55640
City of Pasadena Public Health Department,City of Pasadena Public Health Department,LHJ,Local Health Jurisdiction,10491
Colusa County Public health,Colusa County Public health,LHJ,Local Health Jurisdiction,2068
Contra Costa County Local Health Department,Contra Costa County Local Health Department,LHJ,Local Health Jurisdiction,50563
Costco,Costco,LTCF,LTCF,97473
County of San Diego Health and Human Services Agency,County of San Diego Health and Human Services Agency,LHJ,Local Health Jurisdiction,151140
CPESN,CPESN,LTCF,LTCF,16317
CVS,CVS,LTCF,LTCF,570871
DaVita,DaVita,LTCF,LTCF,505
Del Norte County Public Health,Del Norte County Public Health,LHJ,Local Health Jurisdiction,1514
Dignity Health,Dignity Health,MCE,Multi-County Entity,21845
DSH,DSH,MCE,Multi-County Entity,1672
El Dorado County Public Health Division,El Dorado County Public Health Division,LHJ,Local Health Jurisdiction,7496
FEMA,FEMA,MCE,Multi-County Entity,1105
Fresenius,Fresenius,LTCF,LTCF,422
Fresno County Department of Public Health,Fresno County Department of Public Health,LHJ,Local Health Jurisdiction,56260
GeriMed,GeriMed,LTCF,LTCF,2731
Glenn County Health Department,Glenn County Health Department,LHJ,Local Health Jurisdiction,627
Good Neighbor,Good Neighbor,LTCF,LTCF,111696
Health Mart,Health Mart,LTCF,LTCF,47410
HRSA,HRSA,LTCF,LTCF,145691
Humboldt County Department of Health and Human Services,Humboldt County Department of Health and Human Services,LHJ,Local Health Jurisdiction,8819
Imperial County Health Department,Imperial County Health Department,LHJ,Local Health Jurisdiction,17850
Inyo County Health Department,Inyo County Health Department,LHJ,Local Health Jurisdiction,1724
Kaiser,Kaiser,MCE,Multi-County Entity,526781
Kern County Public Health Services Department,Kern County Public Health Services Department,LHJ,Local Health Jurisdiction,47295
Kings County Health Department,Kings County Health Department,LHJ,Local Health Jurisdiction,5245
Kroger,Kroger,LTCF,LTCF,26850
Lake County Department of Health Services,Lake County Department of Health Services,LHJ,Local Health Jurisdiction,3454
Lassen County Department of Health and Social Services,Lassen County Department of Health and Social Services,LHJ,Local Health Jurisdiction,2110
Long Beach City Department of Health and Human Services,Long Beach City Department of Health and Human Services,LHJ,Local Health Jurisdiction,11204
Los Angeles County Department of Public Health,Los Angeles County Department of Public Health,LHJ,Local Health Jurisdiction,383198
Madera County Public Health,Madera County Public Health,LHJ,Local Health Jurisdiction,9764
Marin County Health and Human Services,Marin County Health and Human Services,LHJ,Local Health Jurisdiction,16492
Mariposa County Health Department,Mariposa County Health Department,LHJ,Local Health Jurisdiction,1420
Med Shoppe/LeaderNet,Med Shoppe/LeaderNet,LTCF,LTCF,139792
Mendocino County Dept of Public Health,Mendocino County Dept of Public Health,LHJ,Local Health Jurisdiction,6940
Merced County Department of Public Health,Merced County Department of Public Health,LHJ,Local Health Jurisdiction,9161
MHA,MHA,LTCF,LTCF,101106
Modoc County Public Health Department,Modoc County Public Health Department,LHJ,Local Health Jurisdiction,1097
Mono County Health Department,Mono County Health Department,LHJ,Local Health Jurisdiction,1255
Monterey County Health Department,Monterey County Health Department,LHJ,Local Health Jurisdiction,17745
MULTI,MULTI,LHJ,Local Health Jurisdiction,%null%
Napa County Health and Human Services Agency,Napa County Health and Human Services Agency,LHJ,Local Health Jurisdiction,2164
Nevada County Public Health Department,Nevada County Public Health Department,LHJ,Local Health Jurisdiction,5759
Orange County Health Care Agency,Orange County Health Care Agency,LHJ,Local Health Jurisdiction,145107
Placer County Public Health Division,Placer County Public Health Division,LHJ,Local Health Jurisdiction,5537
Plumas County Public Health Agency,Plumas County Public Health Agency,LHJ,Local Health Jurisdiction,1451
Premier/Innovatix,Premier/Innovatix,LTCF,LTCF,4062
Providence,Providence,MCE,Multi-County Entity,37633
Rite Aid,Rite Aid,LTCF,LTCF,363129
Riverside County Department of Health,Riverside County Department of Health,LHJ,Local Health Jurisdiction,1006129
Sacramento Department of Health Services,Sacramento Department of Health Services,LHJ,Local Health Jurisdiction,43794
San Benito County Public Health Services,San Benito County Public Health Services,LHJ,Local Health Jurisdiction,3377
San Bernardino County Department of Public Health,San Bernardino County Department of Public Health,LHJ,Local Health Jurisdiction,72673
San Francisco Department of Public Health,San Francisco Department of Public Health,LHJ,Local Health Jurisdiction,36739
San Joaquin County Public Health Services,San Joaquin County Public Health Services,LHJ,Local Health Jurisdiction,51761
San Luis Obispo County Health Department,San Luis Obispo County Health Department,LHJ,Local Health Jurisdiction,3389
San Mateo County Health Service Department,San Mateo County Health Service Department,LHJ,Local Health Jurisdiction,30050
Santa Barbara County Public Health Department,Santa Barbara County Public Health Department,LHJ,Local Health Jurisdiction,18992
Santa Clara County Public Health Department,Santa Clara County Public Health Department,LHJ,Local Health Jurisdiction,99989
Santa Cruz County Local Health Department,Santa Cruz County Local Health Department,LHJ,Local Health Jurisdiction,12141
Shasta County Public Health,Shasta County Public Health,LHJ,Local Health Jurisdiction,4769
Sierra County Health Department,Sierra County Health Department,LHJ,Local Health Jurisdiction,61
Siskiyou County Public Health Department,Siskiyou County Public Health Department,LHJ,Local Health Jurisdiction,5621
Solano County Health and Social Services Dept. - Public Health,Solano County Health and Social Services Dept. - Public Health,LHJ,Local Health Jurisdiction,6199
Sonoma County Department of Health Services,Sonoma County Department of Health Services,LHJ,Local Health Jurisdiction,28110
Stanislaus County Public Health Department,Stanislaus County Public Health Department,LHJ,Local Health Jurisdiction,33124
Sutter County Health Department,Sutter County Health Department,LHJ,Local Health Jurisdiction,7978
Sutter Health,Sutter Health,MCE,Multi-County Entity,29940
Tehama County Health Services Agency,Tehama County Health Services Agency,LHJ,Local Health Jurisdiction,1710
Topco,Topco,LTCF,LTCF,58023
Trinity County Health and Human Services,Trinity County Health and Human Services,LHJ,Local Health Jurisdiction,1381
Tulare County Health and Human Services,Tulare County Health and Human Services,LHJ,Local Health Jurisdiction,21915
Tuolumne County Health Department,Tuolumne County Health Department,LHJ,Local Health Jurisdiction,2599
UC Health,UC Health,MCE,Multi-County Entity,51609
Ventura County Health Department,Ventura County Health Department,LHJ,Local Health Jurisdiction,31993
Walgreens,Walgreens,LTCF,LTCF,212640
Walmart,Walmart,LTCF,LTCF,192586
Yolo County Health and Human Services Agency,Yolo County Health and Human Services Agency,LHJ,Local Health Jurisdiction,11562
