MCE/LHJ/LTCF-value,MCE/LHJ/LTCF-alias,Type-value,Type-alias,AGG(Total On Hand Tiberius)-alias
Adventist Health,Adventist Health,MCE,Multi-County Entity,11138
AHMC,AHMC,MCE,Multi-County Entity,1358
Alameda County Public Health Department,Alameda County Public Health Department,LHJ,Local Health Jurisdiction,66797
Albertsons,Albertsons,LTCF,LTCF,586511
Alpine County Health and Human Services,Alpine County Health and Human Services,LHJ,Local Health Jurisdiction,0
"Amador County, Health and Human Services Agency","Amador County, Health and Human Services Agency",LHJ,Local Health Jurisdiction,2956
Berkeley City Public Health Department,Berkeley City Public Health Department,LHJ,Local Health Jurisdiction,43363
Butte County Department of Public Health,Butte County Department of Public Health,LHJ,Local Health Jurisdiction,4200
Calaveras County Public Health Department,Calaveras County Public Health Department,LHJ,Local Health Jurisdiction,1821
CDCR,CDCR,MCE,Multi-County Entity,29658
CDPH,CDPH,MCE,Multi-County Entity,15006
City of Pasadena Public Health Department,City of Pasadena Public Health Department,LHJ,Local Health Jurisdiction,10054
Colusa County Public health,Colusa County Public health,LHJ,Local Health Jurisdiction,685
Contra Costa County Local Health Department,Contra Costa County Local Health Department,LHJ,Local Health Jurisdiction,63186
Costco,Costco,LTCF,LTCF,109383
County of San Diego Health and Human Services Agency,County of San Diego Health and Human Services Agency,LHJ,Local Health Jurisdiction,119754
CPESN,CPESN,LTCF,LTCF,12608
CVS,CVS,LTCF,LTCF,643415
DaVita,DaVita,LTCF,LTCF,1244
Del Norte County Public Health,Del Norte County Public Health,LHJ,Local Health Jurisdiction,2127
Dignity Health,Dignity Health,MCE,Multi-County Entity,17715
DSH,DSH,MCE,Multi-County Entity,2878
El Dorado County Public Health Division,El Dorado County Public Health Division,LHJ,Local Health Jurisdiction,7931
FEMA,FEMA,MCE,Multi-County Entity,3872
Fresenius,Fresenius,LTCF,LTCF,2446
Fresno County Department of Public Health,Fresno County Department of Public Health,LHJ,Local Health Jurisdiction,58836
GeriMed,GeriMed,LTCF,LTCF,3363
Glenn County Health Department,Glenn County Health Department,LHJ,Local Health Jurisdiction,775
Good Neighbor,Good Neighbor,LTCF,LTCF,108758
Health Mart,Health Mart,LTCF,LTCF,16801
HRSA,HRSA,LTCF,LTCF,248736
Humboldt County Department of Health and Human Services,Humboldt County Department of Health and Human Services,LHJ,Local Health Jurisdiction,15864
Imperial County Health Department,Imperial County Health Department,LHJ,Local Health Jurisdiction,23517
Inyo County Health Department,Inyo County Health Department,LHJ,Local Health Jurisdiction,4205
Kaiser,Kaiser *,MCE,Multi-County Entity,604820
Kern County Public Health Services Department,Kern County Public Health Services Department,LHJ,Local Health Jurisdiction,33710
Kings County Health Department,Kings County Health Department,LHJ,Local Health Jurisdiction,4197
Kroger,Kroger,LTCF,LTCF,41105
Lake County Department of Health Services,Lake County Department of Health Services,LHJ,Local Health Jurisdiction,2108
Lassen County Department of Health and Social Services,Lassen County Department of Health and Social Services,LHJ,Local Health Jurisdiction,2866
Long Beach City Department of Health and Human Services,Long Beach City Department of Health and Human Services,LHJ,Local Health Jurisdiction,12642
Los Angeles County Department of Public Health,Los Angeles County Department of Public Health,LHJ,Local Health Jurisdiction,385935
Madera County Public Health,Madera County Public Health,LHJ,Local Health Jurisdiction,12091
Marin County Health and Human Services,Marin County Health and Human Services,LHJ,Local Health Jurisdiction,14251
Mariposa County Health and Human Services,Mariposa County Health and Human Services,LHJ,Local Health Jurisdiction,1266
Med Shoppe/LeaderNet,Med Shoppe/LeaderNet,LTCF,LTCF,135506
Mendocino County Dept of Public Health,Mendocino County Dept of Public Health,LHJ,Local Health Jurisdiction,4209
Merced County Department of Public Health,Merced County Department of Public Health,LHJ,Local Health Jurisdiction,8513
MHA,MHA,LTCF,LTCF,36286
Modoc County Public Health Department,Modoc County Public Health Department,LHJ,Local Health Jurisdiction,419
Mono County Health Department,Mono County Health Department,LHJ,Local Health Jurisdiction,960
Monterey County Health Department,Monterey County Health Department,LHJ,Local Health Jurisdiction,18979
MULTI,MULTI,LHJ,Local Health Jurisdiction,%null%
Napa County Health and Human Services Agency,Napa County Health and Human Services Agency,LHJ,Local Health Jurisdiction,1230
Nevada County Public Health Department,Nevada County Public Health Department,LHJ,Local Health Jurisdiction,2911
Orange County Health Care Agency,Orange County Health Care Agency,LHJ,Local Health Jurisdiction,102968
Out of State Organizations,Out of State Organizations,MCE,Multi-County Entity,6728
Placer County Public Health Division,Placer County Public Health Division,LHJ,Local Health Jurisdiction,1519
Plumas County Public Health Agency,Plumas County Public Health Agency,LHJ,Local Health Jurisdiction,2706
Premier/Innovatix,Premier/Innovatix,LTCF,LTCF,2276
Providence,Providence,MCE,Multi-County Entity,27813
Rite Aid,Rite Aid,LTCF,LTCF,677895
Riverside County Department of Health,Riverside County Department of Health,LHJ,Local Health Jurisdiction,57846
Sacramento Department of Health Services,Sacramento Department of Health Services,LHJ,Local Health Jurisdiction,39129
San Benito County Public Health Services,San Benito County Public Health Services,LHJ,Local Health Jurisdiction,4781
San Bernardino County Department of Public Health,San Bernardino County Department of Public Health,LHJ,Local Health Jurisdiction,58644
San Francisco Department of Public Health,San Francisco Department of Public Health,LHJ,Local Health Jurisdiction,41987
San Joaquin County Public Health Services,San Joaquin County Public Health Services,LHJ,Local Health Jurisdiction,16477
San Luis Obispo County Health Department,San Luis Obispo County Health Department,LHJ,Local Health Jurisdiction,6584
San Mateo County Health Service Department,San Mateo County Health Service Department,LHJ,Local Health Jurisdiction,28938
Santa Barbara County Public Health Department,Santa Barbara County Public Health Department,LHJ,Local Health Jurisdiction,13738
Santa Clara County Public Health Department,Santa Clara County Public Health Department,LHJ,Local Health Jurisdiction,80813
Santa Cruz County Local Health Department,Santa Cruz County Local Health Department,LHJ,Local Health Jurisdiction,12029
Shasta County Public Health,Shasta County Public Health,LHJ,Local Health Jurisdiction,5013
Sierra County Health Department,Sierra County Health Department,LHJ,Local Health Jurisdiction,600
Siskiyou County Public Health Department,Siskiyou County Public Health Department,LHJ,Local Health Jurisdiction,5297
Solano County Health and Social Services Dept. - Public Health,Solano County Health and Social Services Dept. - Public Health,LHJ,Local Health Jurisdiction,2516
Sonoma County Department of Health Services,Sonoma County Department of Health Services,LHJ,Local Health Jurisdiction,13992
Stanislaus County Public Health Department,Stanislaus County Public Health Department,LHJ,Local Health Jurisdiction,10364
Sutter County Health Department,Sutter County Health Department,LHJ,Local Health Jurisdiction,5968
Sutter Health,Sutter Health,MCE,Multi-County Entity,27954
Tehama County Health Services Agency,Tehama County Health Services Agency,LHJ,Local Health Jurisdiction,3410
Topco,Topco,LTCF,LTCF,1414
Trinity County Health and Human Services,Trinity County Health and Human Services,LHJ,Local Health Jurisdiction,3110
Tulare County Health and Human Services,Tulare County Health and Human Services,LHJ,Local Health Jurisdiction,22332
Tuolumne County Health Department,Tuolumne County Health Department,LHJ,Local Health Jurisdiction,1946
UC Health,UC Health,MCE,Multi-County Entity,87888
Ventura County Health Department,Ventura County Health Department,LHJ,Local Health Jurisdiction,40382
Walgreens,Walgreens,LTCF,LTCF,740803
Walmart,Walmart,LTCF,LTCF,72822
Yolo County Health and Human Services Agency,Yolo County Health and Human Services Agency,LHJ,Local Health Jurisdiction,8541
