MCE/LHJ/LTCF-value,MCE/LHJ/LTCF-alias,Type-value,Type-alias,AGG(Total On Hand Tiberius)-alias
Adventist Health,Adventist Health,MCE,Multi-County Entity,9347
AHMC,AHMC,MCE,Multi-County Entity,996
Alameda County Public Health Department,Alameda County Public Health Department,LHJ,Local Health Jurisdiction,47811
Albertsons,Albertsons,LTCF,LTCF,353596
Alpine County Health and Human Services,Alpine County Health and Human Services,LHJ,Local Health Jurisdiction,0
"Amador County, Health and Human Services Agency","Amador County, Health and Human Services Agency",LHJ,Local Health Jurisdiction,1224
Berkeley City Public Health Department,Berkeley City Public Health Department,LHJ,Local Health Jurisdiction,27781
Butte County Department of Public Health,Butte County Department of Public Health,LHJ,Local Health Jurisdiction,2366
Calaveras County Public Health Department,Calaveras County Public Health Department,LHJ,Local Health Jurisdiction,1052
CDCR,CDCR,MCE,Multi-County Entity,34105
CDPH,CDPH,MCE,Multi-County Entity,16348
City of Pasadena Public Health Department,City of Pasadena Public Health Department,LHJ,Local Health Jurisdiction,6234
Colusa County Public health,Colusa County Public health,LHJ,Local Health Jurisdiction,684
Contra Costa County Local Health Department,Contra Costa County Local Health Department,LHJ,Local Health Jurisdiction,55776
Costco,Costco,LTCF,LTCF,68574
County of San Diego Health and Human Services Agency,County of San Diego Health and Human Services Agency,LHJ,Local Health Jurisdiction,100006
CPESN,CPESN,LTCF,LTCF,11510
CVS,CVS,LTCF,LTCF,310917
DaVita,DaVita,LTCF,LTCF,3814
Del Norte County Public Health,Del Norte County Public Health,LHJ,Local Health Jurisdiction,2781
Dignity Health,Dignity Health,MCE,Multi-County Entity,13400
DSH,DSH,MCE,Multi-County Entity,2450
El Dorado County Public Health Division,El Dorado County Public Health Division,LHJ,Local Health Jurisdiction,5753
FEMA,FEMA,MCE,Multi-County Entity,7032
Fresenius,Fresenius,LTCF,LTCF,5932
Fresno County Department of Public Health,Fresno County Department of Public Health,LHJ,Local Health Jurisdiction,43506
GeriMed,GeriMed,LTCF,LTCF,1504
Glenn County Health Department,Glenn County Health Department,LHJ,Local Health Jurisdiction,312
Good Neighbor,Good Neighbor,LTCF,LTCF,77300
Health Mart,Health Mart,LTCF,LTCF,11277
HRSA,HRSA,LTCF,LTCF,243912
Humboldt County Department of Health and Human Services,Humboldt County Department of Health and Human Services,LHJ,Local Health Jurisdiction,10287
Imperial County Health Department,Imperial County Health Department,LHJ,Local Health Jurisdiction,12273
Inyo County Health Department,Inyo County Health Department,LHJ,Local Health Jurisdiction,1805
Kaiser,Kaiser *,MCE,Multi-County Entity,502243
Kern County Public Health Services Department,Kern County Public Health Services Department,LHJ,Local Health Jurisdiction,19306
Kings County Health Department,Kings County Health Department,LHJ,Local Health Jurisdiction,2846
Kroger,Kroger,LTCF,LTCF,32198
Lake County Department of Health Services,Lake County Department of Health Services,LHJ,Local Health Jurisdiction,1298
Lassen County Department of Health and Social Services,Lassen County Department of Health and Social Services,LHJ,Local Health Jurisdiction,2442
Long Beach City Department of Health and Human Services,Long Beach City Department of Health and Human Services,LHJ,Local Health Jurisdiction,10791
Los Angeles County Department of Public Health,Los Angeles County Department of Public Health,LHJ,Local Health Jurisdiction,301260
Madera County Public Health,Madera County Public Health,LHJ,Local Health Jurisdiction,11353
Marin County Health and Human Services,Marin County Health and Human Services,LHJ,Local Health Jurisdiction,10801
Mariposa County Health and Human Services,Mariposa County Health and Human Services,LHJ,Local Health Jurisdiction,952
Med Shoppe/LeaderNet,Med Shoppe/LeaderNet,LTCF,LTCF,390306
Mendocino County Dept of Public Health,Mendocino County Dept of Public Health,LHJ,Local Health Jurisdiction,3737
Merced County Department of Public Health,Merced County Department of Public Health,LHJ,Local Health Jurisdiction,7707
MHA,MHA,LTCF,LTCF,43678
Modoc County Public Health Department,Modoc County Public Health Department,LHJ,Local Health Jurisdiction,241
Mono County Health Department,Mono County Health Department,LHJ,Local Health Jurisdiction,1857
Monterey County Health Department,Monterey County Health Department,LHJ,Local Health Jurisdiction,17640
MULTI,MULTI,LHJ,Local Health Jurisdiction,%null%
Napa County Health and Human Services Agency,Napa County Health and Human Services Agency,LHJ,Local Health Jurisdiction,1481
Nevada County Public Health Department,Nevada County Public Health Department,LHJ,Local Health Jurisdiction,2849
Orange County Health Care Agency,Orange County Health Care Agency,LHJ,Local Health Jurisdiction,70092
Out of State Organizations,Out of State Organizations,MCE,Multi-County Entity,2690
Placer County Public Health Division,Placer County Public Health Division,LHJ,Local Health Jurisdiction,3032
Plumas County Public Health Agency,Plumas County Public Health Agency,LHJ,Local Health Jurisdiction,1608
Premier/Innovatix,Premier/Innovatix,LTCF,LTCF,2434
Providence,Providence,MCE,Multi-County Entity,31639
Rite Aid,Rite Aid,LTCF,LTCF,493745
Riverside County Department of Health,Riverside County Department of Health,LHJ,Local Health Jurisdiction,113892
Sacramento Department of Health Services,Sacramento Department of Health Services,LHJ,Local Health Jurisdiction,33482
San Benito County Public Health Services,San Benito County Public Health Services,LHJ,Local Health Jurisdiction,3430
San Bernardino County Department of Public Health,San Bernardino County Department of Public Health,LHJ,Local Health Jurisdiction,47576
San Francisco Department of Public Health,San Francisco Department of Public Health,LHJ,Local Health Jurisdiction,39877
San Joaquin County Public Health Services,San Joaquin County Public Health Services,LHJ,Local Health Jurisdiction,12014
San Luis Obispo County Health Department,San Luis Obispo County Health Department,LHJ,Local Health Jurisdiction,2471
San Mateo County Health Service Department,San Mateo County Health Service Department,LHJ,Local Health Jurisdiction,19754
Santa Barbara County Public Health Department,Santa Barbara County Public Health Department,LHJ,Local Health Jurisdiction,13509
Santa Clara County Public Health Department,Santa Clara County Public Health Department,LHJ,Local Health Jurisdiction,58771
Santa Cruz County Local Health Department,Santa Cruz County Local Health Department,LHJ,Local Health Jurisdiction,4644
Shasta County Public Health,Shasta County Public Health,LHJ,Local Health Jurisdiction,4856
Sierra County Health Department,Sierra County Health Department,LHJ,Local Health Jurisdiction,387
Siskiyou County Public Health Department,Siskiyou County Public Health Department,LHJ,Local Health Jurisdiction,3272
Solano County Health and Social Services Dept. - Public Health,Solano County Health and Social Services Dept. - Public Health,LHJ,Local Health Jurisdiction,5206
Sonoma County Department of Health Services,Sonoma County Department of Health Services,LHJ,Local Health Jurisdiction,10065
Stanislaus County Public Health Department,Stanislaus County Public Health Department,LHJ,Local Health Jurisdiction,7219
Sutter County Health Department,Sutter County Health Department,LHJ,Local Health Jurisdiction,5081
Sutter Health,Sutter Health,MCE,Multi-County Entity,25057
Tehama County Health Services Agency,Tehama County Health Services Agency,LHJ,Local Health Jurisdiction,1607
Topco,Topco,LTCF,LTCF,1117
Trinity County Health and Human Services,Trinity County Health and Human Services,LHJ,Local Health Jurisdiction,1177
Tulare County Health and Human Services,Tulare County Health and Human Services,LHJ,Local Health Jurisdiction,9979
Tuolumne County Health Department,Tuolumne County Health Department,LHJ,Local Health Jurisdiction,2211
UC Health,UC Health,MCE,Multi-County Entity,56224
Ventura County Health Department,Ventura County Health Department,LHJ,Local Health Jurisdiction,30721
Walgreens,Walgreens,LTCF,LTCF,514524
Walmart,Walmart,LTCF,LTCF,62349
Yolo County Health and Human Services Agency,Yolo County Health and Human Services Agency,LHJ,Local Health Jurisdiction,6711
